{
  "@context": [
    "https://www.w3.org/ns/credentials/v2",
    "https://uai.world/ns/credentials/v1"
  ],
  "type": [
    "VerifiableCredential",
    "AgentIdentityCredential"
  ],
  "id": "urn:uai:credential:01JY8RB1C2D3E4F5G6H7J8K9M0",
  "issuer": "did:web:credentials.uai.world",
  "validFrom": "2026-09-22T14:02:04Z",
  "validUntil": "2027-09-22T14:02:04Z",
  "credentialSubject": {
    "id": "did:uai:agent:01JY8R9ZAF392N7QX2T81JH6KM",
    "name": "SupportTriage",
    "agentType": "assistant",
    "primaryJurisdiction": "DE",
    "assuranceLevel": "UAI-AL0",
    "agentKeyThumbprint": "sha256:3f9a2c3f9a2c3f9a2c3f9a2c3f9a2c3f9a2c3f9a2c3f9a2c3f9a2c3f9a2cabcd"
  },
  "proof": {
    "type": "DataIntegrityProof",
    "cryptosuite": "eddsa-jcs-2022",
    "created": "2026-09-22T14:02:04Z",
    "verificationMethod": "did:web:credentials.uai.world#key-1",
    "proofPurpose": "assertionMethod",
    "domain": "UAI-v1:credential",
    "proofValue": "z4oey5q7WcH9NsRpXFvZtL3mBd8kYgQ2eJrTuA6hVwCxSnPbGfDzM1iK"
  },
  "credentialStatus": {
    "type": "BitstringStatusListEntry",
    "statusPurpose": "revocation",
    "statusListIndex": "4821",
    "statusListCredential": "https://status.uai.world/lists/agents/17"
  }
}
